{
  "version": "1.0",
  "run_id": "conference-136-scan-001",
  "agent": {
    "model": "qwen3-coder-next",
    "client": "local-agent"
  },
  "decisions": [
    {
      "id": "decision-001",
      "type": "article_match",
      "status": "approved",
      "confidence": 0.95,
      "source_file": "Заявки/2 Желінська, Ганєва/article.docx",
      "excel_article_id": "136002-136003",
      "reason": "authors match and full multiline title matches Excel",
      "evidence": [
        "authors",
        "four-paragraph title"
      ],
      "operator_approved": true
    }
  ]
}